    ---------------------- Device Descriptor ----------------------
bLength                  : 0x12 (18 bytes)
bDescriptorType          : 0x01 (Device Descriptor)
bcdUSB                   : 0x110 (USB Version 1.10)
bDeviceClass             : 0x00 (defined by the interface descriptors)
bDeviceSubClass          : 0x00
bDeviceProtocol          : 0x00
bMaxPacketSize0          : 0x08 (8 bytes)
idVendor                 : 0x16C0 (Van Ooijen Technische Informatica)
idProduct                : 0x05DF
bcdDevice                : 0x0200
iManufacturer            : 0x01 (String Descriptor 1)
 Language 0x0409         : "hw-by-design.blogspot.com"
iProduct                 : 0x02 (String Descriptor 2)
 Language 0x0409         : "HID Multimedia Dial"
iSerialNumber            : 0x03 (String Descriptor 3)
 Language 0x0409         : "0002"
bNumConfigurations       : 0x01 (1 Configuration)
Data (HexDump)           : 12 01 10 01 00 00 00 08 C0 16 DF 05 00 02 01 02   ................
                           03 01                                             ..

    ------------------ Configuration Descriptor -------------------
bLength                  : 0x09 (9 bytes)
bDescriptorType          : 0x02 (Configuration Descriptor)
wTotalLength             : 0x0022 (34 bytes)
bNumInterfaces           : 0x01 (1 Interface)
bConfigurationValue      : 0x01 (Configuration 1)
iConfiguration           : 0x00 (No String Descriptor)
bmAttributes             : 0x80
 D7: Reserved, set 1     : 0x01
 D6: Self Powered        : 0x00 (no)
 D5: Remote Wakeup       : 0x00 (no)
 D4..0: Reserved, set 0  : 0x00
MaxPower                 : 0x05 (10 mA)
Data (HexDump)           : 09 02 22 00 01 01 00 80 05 09 04 01 00 01 03 00   ..".............
                           00 00 09 21 10 01 00 01 22 2B 00 07 05 81 03 08   ...!...."+......
                           00 0A                                             ..

        ---------------- Interface Descriptor -----------------
bLength                  : 0x09 (9 bytes)
bDescriptorType          : 0x04 (Interface Descriptor)
bInterfaceNumber         : 0x01
bAlternateSetting        : 0x00
bNumEndpoints            : 0x01 (1 Endpoint)
bInterfaceClass          : 0x03 (HID - Human Interface Device)
bInterfaceSubClass       : 0x00 (None)
bInterfaceProtocol       : 0x00 (None)
iInterface               : 0x00 (No String Descriptor)
Data (HexDump)           : 09 04 01 00 01 03 00 00 00                        .........

        ------------------- HID Descriptor --------------------
bLength                  : 0x09 (9 bytes)
bDescriptorType          : 0x21 (HID Descriptor)
bcdHID                   : 0x0110 (HID Version 1.10)
bCountryCode             : 0x00 (00 = not localized)
bNumDescriptors          : 0x01
Data (HexDump)           : 09 21 10 01 00 01 22 2B 00                        .!...."+.
Descriptor 1:
bDescriptorType          : 0x22 (Class=Report)
wDescriptorLength        : 0x002B (43 bytes)
Error reading descriptor : ERROR_INVALID_PARAMETER

        ----------------- Endpoint Descriptor -----------------
bLength                  : 0x07 (7 bytes)
bDescriptorType          : 0x05 (Endpoint Descriptor)
bEndpointAddress         : 0x81 (Direction=IN EndpointID=1)
bmAttributes             : 0x03 (TransferType=Interrupt)
wMaxPacketSize           : 0x0008
bInterval                : 0x0A (10 ms)
Data (HexDump)           : 07 05 81 03 08 00 0A                              .......

      -------------------- String Descriptors -------------------
             ------ String Descriptor 0 ------
bLength                  : 0x04 (4 bytes)
bDescriptorType          : 0x03 (String Descriptor)
Language ID[0]           : 0x0409 (English - United States)
Data (HexDump)           : 04 03 09 04                                       ....
             ------ String Descriptor 1 ------
bLength                  : 0x34 (52 bytes)
bDescriptorType          : 0x03 (String Descriptor)
Language 0x0409          : "hw-by-design.blogspot.com"
Data (HexDump)           : 34 03 68 00 77 00 2D 00 62 00 79 00 2D 00 64 00   4.h.w.-.b.y.-.d.
                           65 00 73 00 69 00 67 00 6E 00 2E 00 62 00 6C 00   e.s.i.g.n...b.l.
                           6F 00 67 00 73 00 70 00 6F 00 74 00 2E 00 63 00   o.g.s.p.o.t...c.
                           6F 00 6D 00                                       o.m.
             ------ String Descriptor 2 ------
bLength                  : 0x28 (40 bytes)
bDescriptorType          : 0x03 (String Descriptor)
Language 0x0409          : "HID Multimedia Dial"
Data (HexDump)           : 28 03 48 00 49 00 44 00 20 00 4D 00 75 00 6C 00   (.H.I.D. .M.u.l.
                           74 00 69 00 6D 00 65 00 64 00 69 00 61 00 20 00   t.i.m.e.d.i.a. .
                           44 00 69 00 61 00 6C 00                           D.i.a.l.
             ------ String Descriptor 3 ------
bLength                  : 0x0A (10 bytes)
bDescriptorType          : 0x03 (String Descriptor)
Language 0x0409          : "0002"
Data (HexDump)           : 0A 03 30 00 30 00 30 00 32 00                     ..0.0.0.2.
